<?xml version="1.0" encoding="UTF-8"?>
<!DOCTYPE Dashboard PUBLIC "-//MC4J//DTD Dashboard 1.0//EN" "http://mc4j.sourceforge.net/Dashboard_1_0.dtd">

<!--
    Document   : BasicMBean.xml
    Created on : October 6, 2002, 10:01 PM
    Author     : ghinkl
    Description:
        Displays the basic information of an MBean
-->

<Dashboard version="1.0" name="Carbon Memory Info">
    <Description>This dashboard displays basic information relating to the 
    overall execution of the Carbon Framework.</Description>

  <DashboardMatch type="Global">
      <BeanMatch id="BeanNode" type="Single">
          <Condition type="BeanObjectNameCondition" filter="CarbonManagementComponent"/>
      </BeanMatch>
  </DashboardMatch>

    <LayoutManager type="java.awt.BorderLayout"/>
    <Content>

        <Component type="javax.swing.JPanel">
            <Constraint type="BorderConstraints" direction="NORTH"/>
            <!--LayoutManager type="java.awt.GridBagLayout"/-->
            <LayoutManager type="java.awt.GridLayout" rows="2" cols="1"/>
            <Content>
                <Component type="javax.swing.JLabel" id="titleLable">
                    <!--Constraint type="java.awt.GridBagConstraints" anchor="NORTHWEST" fill="HORIZONTAL" gridx="1" gridy="1"/-->
                    <Attribute name="text" value="(Literal)Carbon Management Dashboard"/>
                    <Attribute name="font" value="(Literal)Dialog bold 24"/>
                    <Attribute name="foreground" value="(Literal)0xFF2222"/>

                </Component>

                <Component type="javax.swing.JTextArea">
                    <!--Constraint type="java.awt.GridBagConstraints" anchor="NORTH" gridx="1" gridy="2"/-->
                    <Attribute name="text" value="(Literal)This Dashboard displays important information about the status of your Carbon Component Framework."/>
                    <Attribute name="opaque" value="(Literal)false"/>
                    <Attribute name="editable" value="(Literal)false"/>
                </Component>

            </Content>
        </Component>

        <Component type="javax.swing.JScrollPane">
            <Content>
                <Component type="javax.swing.JPanel">
                    <LayoutManager type="java.awt.BoxLayout" axis="Y_AXIS"/>

                    <Constraint type="BorderConstraints" direction="CENTER"/>
                    <Attribute name="background" value="(Literal)0xFFFFFF"/>
                    <Content>
                        <Component type="org.mc4j.console.swing.SectionHolder">
                            <Attribute name="title" value="(Literal)General Carbon Information"/>
                            <Attribute name="background" value="(Literal)0xFFFFFF"/>
                            <Content>
                                <Component type="org.mc4j.console.dashboard.components.NumericAttributeGraph">
                                    <Attribute name="beanNode" value="BeanNode"/>
                                    <Constraint type="java.awt.GridBagConstraints" anchor="NORTH" gridx="1" gridy="2" widthx="2" weightx="0.5" weighty="0.5" fill="BOTH" insets="3,3,3,3"/>
                                    <Attribute name="preferredSize" value="(Literal)600,600"/>
                                    <Attribute name="updateInterval" value="(Literal)500"/>
                                    <Attribute name="attributeName" value="(Literal)FreeMemory"/>
                                </Component>
                            </Content>
                        </Component>
                        <Component type="org.mc4j.console.swing.SectionHolder">
                            <Attribute name="title" value="(Literal)General Carbon Information"/>
                            <Attribute name="background" value="(Literal)0xFFFFFF"/>
                            <Content>
                                <Component type="org.mc4j.console.dashboard.components.NumericAttributeGraph">
                                    <Attribute name="beanNode" value="BeanNode"/>
                                    <Constraint type="java.awt.GridBagConstraints" anchor="NORTH" gridx="2" gridy="2" widthx="2" weightx="0.5" weighty="0.5" fill="BOTH" insets="3,3,3,3"/>
                                    <Attribute name="attributeName" value="(Literal)ActiveThreadCount"/>
                                </Component>
                            </Content>
                        </Component>
                    </Content>
                </Component>
            </Content>
        </Component>
    </Content>
</Dashboard>
