<?xml version="1.0" encoding="UTF-8"?>
<!DOCTYPE Dashboard PUBLIC "-//MC4J//DTD Dashboard 1.0//EN" "http://mc4j.sourceforge.net/Dashboard_1_0.dtd">

<Dashboard version="1.0" name="Carbon Configuration Tree">

  <Description>This dashboard shows a tree view Carbon Configurations.</Description>

  <DashboardMatch type="Global">
      <BeanMatch id="BeanNode" type="Single">
          <Condition type="BeanObjectNameCondition" filter="type=org.sape.carbon.services.carbonmanagement.CarbonManagementService"/>
      </BeanMatch>
  </DashboardMatch>

  <LayoutManager type="java.awt.BorderLayout"/>
  <Content>

    <!-- *** Header *** -->
    <Component type="javax.swing.JPanel">
        <Constraint type="BorderConstraints" direction="NORTH"/>
        <LayoutManager type="java.awt.BorderLayout"/>
        <Content>
            <Component type="javax.swing.JLabel" id="titleLable">
                <Constraint type="BorderConstraints" direction="CENTER"/>
                <Attribute name="text" value="DashboardName"/>
                <Attribute name="font" value="(Literal)Dialog bold 24"/>
                <Attribute name="foreground" value="(Literal)0xFF2222"/>
            </Component>

            <Component type="org.mc4j.console.dashboard.components.RefreshControlComponent">
                <Constraint type="BorderConstraints" direction="EAST"/>
                <Attribute name="refreshDelay" value="(Literal)30000"/>
            </Component>

            <Component type="javax.swing.JTextArea">
                <Constraint type="BorderConstraints" direction="SOUTH"/>
                <Attribute name="text" value="DashboardDescription"/>
                <Attribute name="font" value="(Literal)Dialog bold 16"/>
                <Attribute name="opaque" value="(Literal)false"/>
                <Attribute name="editable" value="(Literal)false"/>
            </Component>

        </Content>
    </Component>



    <Component type="org.mc4j.carbon.config.tree.ConfigurationTreeComponent">
        <Constraint type="BorderConstraints" direction="CENTER"/>
        <Attribute name="background" value="(Literal)0xFFFFFF"/>

    </Component>


  </Content>
</Dashboard>
