<?xml version="1.0" encoding="UTF-8"?>
<!DOCTYPE Dashboard PUBLIC "-//MC4J//DTD Dashboard 1.0//EN" "http://mc4j.sourceforge.net/Dashboard_1_0.dtd">


<Dashboard version="1.0" name="JBoss Jetty Statistics">
  
  <Description>This dashboard shows the statistics of a Jetty servlet context.</Description>
 
  <DashboardMatch type="Global" location="/JBoss/Web" >
      <BeanMatch id="Jetty" type="Single">
          <Condition type="BeanObjectNameCondition" filter="^jboss.jetty:Server=0$"/>
      </BeanMatch>
  </DashboardMatch>

  <LayoutManager type="java.awt.BorderLayout"/>
  <Content>
    
    <!-- *** The header section displays title and a refresh control *** -->
    <Component type="javax.swing.JPanel">
        <Constraint type="BorderConstraints" direction="NORTH"/>
        <LayoutManager type="java.awt.BorderLayout"/>
        <Border type="javax.swing.border.EmptyBorder" top="(Literal)2" left="(Literal)5" bottom="(Literal)2" right="(Literal)5"/>
        <Content>
            <Component type="javax.swing.JPanel">
                <Constraint type="BorderConstraints" direction="CENTER"/>
                <LayoutManager type="java.awt.BorderLayout"/>
                <Content>
                    <Component type="javax.swing.JLabel" id="titleLable">
                        <Constraint type="BorderConstraints" direction="CENTER"/>
                        <Attribute name="text" value="DashboardName"/>
                        <Attribute name="font" value="(Literal)SansSerif bold 20"/>
                        <Attribute name="foreground" value="(Literal)0x666666"/>
                    </Component>
                    <Component type="javax.swing.JTextArea">
                        <Constraint type="BorderConstraints" direction="SOUTH"/>
                        <Attribute name="text" value="DashboardDescription"/>
                        <Attribute name="font" value="(Literal)DialogInput bold 14"/>
                        <Attribute name="opaque" value="(Literal)false"/>
                        <Attribute name="editable" value="(Literal)false"/>
                    </Component>
                </Content>
            </Component>
            <Component type="org.mc4j.console.dashboard.components.RefreshControlComponent">
                <Constraint type="BorderConstraints" direction="EAST"/>
                <Attribute name="refreshDelay" value="(Literal)1000"/>
            </Component>
        </Content>
    </Component>
    
    
    <!-- *** Scroll pane of info *** -->
    <Component type="javax.swing.JScrollPane">
            <Attribute name="background" value="(Literal)0xFFFFFF"/>
            <Content>
                <Component type="javax.swing.JPanel">
                    <Attribute name="background" value="(Literal)0xFFFFFF"/>
    
                    <Constraint type="BorderConstraints" direction="CENTER"/>
    
                    <Attribute name="preferredSize" value="100,100"/>
    
                    <LayoutManager type="java.awt.BoxLayout" axis="Y_AXIS"/>
                    <Content>
                        <Component type="org.mc4j.console.swing.SectionHolder">
                            <Attribute name="title" value="(Literal)Connection Information"/>
                            <Attribute name="background" value="(Literal)0xFFFFFF"/>
                            <LayoutManager type="java.awt.GridLayout" rows="1" cols="2"/>
                            <Content>
                                <Component type="org.mc4j.console.dashboard.components.NumericAttributeGraph">
                                    <Attribute name="beanNode" value="Jetty"/>
                                    <Attribute name="preferredSize" value="(Literal)400,150"/>
                                    <Attribute name="attributeName" value="(Literal)connections"/>
                                    <Attribute name="attributeName" value="(Literal)connectionsOpen"/>
                                    <Attribute name="attributeName" value="(Literal)connectionsOpenMax"/>
                                    <Attribute name="attributeName" value="(Literal)connectionsRequestsAve"/>
                                    <Attribute name="attributeName" value="(Literal)connectionsRequestsMax"/>
                                 </Component>
                                 <Component type="org.mc4j.console.dashboard.components.NumericAttributeGraph">
                                     <Attribute name="beanNode" value="Jetty"/>
                                     <Attribute name="preferredSize" value="(Literal)400,150"/>
                                     <Attribute name="attributeName" value="(Literal)connectionsDurationAve"/>
                                     <Attribute name="attributeName" value="(Literal)connectionsDurationMax"/>
                                 </Component>
                            </Content>
                        </Component>
                        <Component type="org.mc4j.console.swing.SectionHolder">
                            <Attribute name="title" value="(Literal)Requests Information"/>
                            <Attribute name="background" value="(Literal)0xFFFFFF"/>
                            <LayoutManager type="java.awt.GridLayout" rows="1" cols="2"/>
                            <Content>
                                <Component type="org.mc4j.console.dashboard.components.NumericAttributeGraph">
                                    <Attribute name="beanNode" value="Jetty"/>
                                    <Attribute name="preferredSize" value="(Literal)400,150"/>
                                    <Attribute name="attributeName" value="(Literal)requests"/>
                                    <Attribute name="attributeName" value="(Literal)requestsActive"/>
                                    <Attribute name="attributeName" value="(Literal)requestsActiveMax"/>
                                 </Component>

                                <Component type="org.mc4j.console.dashboard.components.NumericAttributeGraph">
                                    <Attribute name="beanNode" value="Jetty"/>
                                    <Attribute name="preferredSize" value="(Literal)400,150"/>
                                    <Attribute name="attributeName" value="(Literal)requestsDurationAve"/>
                                    <Attribute name="attributeName" value="(Literal)requestsDurationMax"/>
                                 </Component>                            
                             </Content>
                        </Component>
                        <Component type="org.mc4j.console.dashboard.components.FillerComponent">
                            <Attribute name="type" value="(Literal)VERTICAL_GLUE_SHAPE"/>
                        </Component>
                    </Content>
    
                </Component>
            </Content>
    </Component>
    
    
  </Content>
</Dashboard>
