<?xml version="1.0" encoding="UTF-8"?>
<!DOCTYPE Dashboard PUBLIC "-//MC4J//DTD Dashboard 1.0//EN" "http://mc4j.sourceforge.net/Dashboard_1_0.dtd">

<!--
    Document   : BasicMBean.xml
    Created on : October 6, 2002, 10:01 PM
    Author     : ghinkl
    Description:
        Displays the basic information of an MBean
-->

<Dashboard version="1.0" name="Html Document View">
  <Description>Uses html to lay out a dashboard.</Description>

  <DashboardMatch type="Bean">
      <BeanMatch id="BeanNode" type="Single">
          <Condition type="BeanObjectNameCondition" filter=".*"/>
      </BeanMatch>
  </DashboardMatch>

  <LayoutManager type="java.awt.BorderLayout"/>
  <Content>


    <Component type="org.mc4j.console.dashboard.components.html.HtmlDashboardComponent">
        <Attribute name="htmlDocumentName" value="(Literal)HtmlDocumentTest.html"/>

        <Content>
            <Component id="attributeTable"  type="org.mc4j.console.dashboard.components.AttributeTreeTableExplorer">
                <!-- *** Notice were setting the node that we matched above by name here *** -->
                <Attribute name="beanNode" value="BeanNode"/>
                <Border type="javax.swing.border.LineBorder" color="(Literal)0x444444" thickness="(Literal)1"/>
                <Attribute name="background" value="(Literal)0xFFFFFF"/>
                <Attribute name="background" value="(Literal)0xFFFFFF"/>
            </Component>


        </Content>

    </Component>


  </Content>
</Dashboard>
