<?xml version="1.0" encoding="UTF-8"?>
<!DOCTYPE Dashboard PUBLIC "-//MC4J//DTD Dashboard 1.0//EN" "http://mc4j.sourceforge.net/Dashboard_1_0.dtd">

<Dashboard version="1.0" name="Execute Queue Statistics">

  <Description>This dashboard shows the statistics of a WebLogic Execute Queue.</Description>
 
  <DashboardMatch type="Global" location="/Weblogic/Web">
      <BeanMatch id="ExecuteQueueRuntimeBean" type="Single">
          <Condition type="BeanObjectNameCondition" filter="Type=ExecuteQueueRuntime"/>
      </BeanMatch>
  </DashboardMatch>


  <LayoutManager type="java.awt.BorderLayout"/>
  <Content>
    
    <!-- *** The header section displays title and a refresh control *** -->
    <Component type="javax.swing.JPanel">
        <Constraint type="BorderConstraints" direction="NORTH"/>
        <LayoutManager type="java.awt.BorderLayout"/>
        <Border type="javax.swing.border.EmptyBorder" top="(Literal)2" left="(Literal)5" bottom="(Literal)2" right="(Literal)5"/>
        <Content>
            <Component type="javax.swing.JPanel">
                <Constraint type="BorderConstraints" direction="CENTER"/>
                <LayoutManager type="java.awt.BorderLayout"/>
                <Content>
                    <Component type="javax.swing.JLabel" id="titleLable">
                        <Constraint type="BorderConstraints" direction="CENTER"/>
                        <Attribute name="text" value="DashboardName"/>
                        <Attribute name="font" value="(Literal)SansSerif bold 20"/>
                        <Attribute name="foreground" value="(Literal)0x666666"/>
                    </Component>
                    <Component type="javax.swing.JTextArea">
                        <Constraint type="BorderConstraints" direction="SOUTH"/>
                        <Attribute name="text" value="DashboardDescription"/>
                        <Attribute name="font" value="(Literal)DialogInput bold 14"/>
                        <Attribute name="opaque" value="(Literal)false"/>
                        <Attribute name="editable" value="(Literal)false"/>
                    </Component>
                </Content>
            </Component>
        </Content>
    </Component>
    
    
    <!-- *** Scroll pane of info *** -->
    <Component type="javax.swing.JScrollPane">
            <Attribute name="background" value="(Literal)0xFFFFFF"/>
            <Content>
                <Component type="javax.swing.JPanel">
                    <Attribute name="background" value="(Literal)0xFFFFFF"/>
    
                    <Constraint type="BorderConstraints" direction="CENTER"/>
    
                    <Attribute name="preferredSize" value="100,100"/>
    
                    <LayoutManager type="java.awt.BoxLayout" axis="Y_AXIS"/>
                    <Content>
                        <Component type="org.mc4j.console.swing.SectionHolder">
                            <Attribute name="title" value="(Literal)Pending Requests"/>
                            <Attribute name="background" value="(Literal)0xFFFFFF"/>
                            <LayoutManager type="java.awt.GridLayout" rows="1" cols="1"/>
                            <Content>
                                <Component type="org.mc4j.console.dashboard.components.NumericAttributeGraph">
                                    <Attribute name="beanNode" value="ExecuteQueueRuntimeBean"/>
                                    <Attribute name="preferredSize" value="(Literal)400,150"/>
                                    <Attribute name="attributeName" value="(Literal)PendingRequestCurrentCount"/>
                                 </Component>
                            </Content>
                        </Component>
                        <Component type="org.mc4j.console.swing.SectionHolder">
                            <Attribute name="title" value="(Literal)Requests Information"/>
                            <Attribute name="background" value="(Literal)0xFFFFFF"/>
                            <LayoutManager type="java.awt.GridLayout" rows="1" cols="1"/>
                            <Content>
                                <Component type="org.mc4j.console.dashboard.components.NumericAttributeGraph">
                                    <Attribute name="beanNode" value="ExecuteQueueRuntimeBean"/>
                                    <Attribute name="preferredSize" value="(Literal)400,150"/>
                                    <Attribute name="attributeName" value="(Literal)ServicedRequestTotalCount"/>
                                 </Component>                          
                             </Content>
                        </Component>
                        <Component type="org.mc4j.console.swing.SectionHolder">
                            <Attribute name="title" value="(Literal)Requests Information"/>
                            <Attribute name="background" value="(Literal)0xFFFFFF"/>
                            <LayoutManager type="java.awt.GridLayout" rows="1" cols="1"/>
                            <Content>
                                <Component type="org.mc4j.console.dashboard.components.NumericAttributeGraph">
                                    <Attribute name="beanNode" value="ExecuteQueueRuntimeBean"/>
                                    <Attribute name="preferredSize" value="(Literal)400,150"/>
                                    <Attribute name="attributeName" value="(Literal)ExecuteThreadCurrentIdleCount"/>
                                 </Component>                          
                             </Content>
                        </Component>
                        <Component type="org.mc4j.console.dashboard.components.FillerComponent">
                            <Attribute name="type" value="(Literal)VERTICAL_GLUE_SHAPE"/>
                        </Component>
                    </Content>
    
                </Component>
            </Content>
    </Component>
    
    
  </Content>
</Dashboard>
