<?xml version="1.0" encoding="UTF-8"?>
<!DOCTYPE Dashboard PUBLIC "-//MC4J//DTD Dashboard 1.0//EN" "http://mc4j.sourceforge.net/Dashboard_1_0.dtd">

<Dashboard version="1.0" name="Servlet Statistics">

  <Description>This dashboard shows the statistics of Weblogic Servlets.</Description>
 
  <DashboardMatch type="Global" location="/Weblogic/Web">
      <BeanMatch id="ServletRuntimeList" type="Multiple">
          <Condition type="BeanObjectNameCondition" filter="Type=ServletRuntime"/>
      </BeanMatch>
  </DashboardMatch>

  <LayoutManager type="java.awt.BorderLayout"/>
  <Content>

    <!-- *** The header section displays title and a refresh control *** -->
    <Component type="javax.swing.JPanel">
        <Constraint type="BorderConstraints" direction="NORTH"/>
        <LayoutManager type="java.awt.BorderLayout"/>
        <Border type="javax.swing.border.EmptyBorder" top="(Literal)2" left="(Literal)5" bottom="(Literal)2" right="(Literal)5"/>
        <Content>
            <Component type="javax.swing.JPanel">
                <Constraint type="BorderConstraints" direction="CENTER"/>
                <LayoutManager type="java.awt.BorderLayout"/>
                <Content>
                    <Component type="javax.swing.JLabel" id="titleLable">
                        <Constraint type="BorderConstraints" direction="CENTER"/>
                        <Attribute name="text" value="DashboardName"/>
                        <Attribute name="font" value="(Literal)SansSerif bold 20"/>
                        <Attribute name="foreground" value="(Literal)0x666666"/>
                    </Component>
                    <Component type="javax.swing.JTextArea">
                        <Constraint type="BorderConstraints" direction="SOUTH"/>
                        <Attribute name="text" value="DashboardDescription"/>
                        <Attribute name="font" value="(Literal)DialogInput bold 14"/>
                        <Attribute name="opaque" value="(Literal)false"/>
                        <Attribute name="editable" value="(Literal)false"/>
                    </Component>
                </Content>
            </Component>
            <Component type="org.mc4j.console.dashboard.components.RefreshControlComponent">
                <Constraint type="BorderConstraints" direction="EAST"/>
                <Attribute name="refreshDelay" value="(Literal)30000"/>
            </Component>
        </Content>
    </Component>


    <Component type="org.mc4j.console.dashboard.components.AttributeTableComponent">
        <Attribute name="beanList" value="ServletRuntimeList"/>
        <Constraint type="BorderConstraints" direction="CENTER"/>

        <Attribute name="background" value="(Literal)0xFFFFFF"/>
        <Attribute name="preferredSize" value="100,100"/>

        <Attribute name="AttributeName" value="(Literal)ServerRuntime"/>
        <Attribute name="AttributeName" value="(Literal)Name"/>
        <Attribute name="AttributeName" value="(Literal)ServletName"/>

        <Attribute name="AttributeName" value="(Literal)ExecutionTimeAverage"/>
        <Attribute name="AttributeName" value="(Literal)ExecutionTimeHigh"/>
        <Attribute name="AttributeName" value="(Literal)ExecutionTimeLow"/>
        <Attribute name="AttributeName" value="(Literal)ExecutionTimeTotal"/>
        <Attribute name="AttributeName" value="(Literal)InvocationTotalCount"/>

    </Component>


  </Content>
</Dashboard>
