<?xml version="1.0" encoding="UTF-8"?>
<!DOCTYPE Dashboard PUBLIC "-//MC4J//DTD Dashboard 1.0//EN" "http://mc4j.sourceforge.net/Dashboard_1_0.dtd">

<!--
Author Greg Hinkle (ghinkle@users.sourceforge.net), May 2003
$Revision: 1.4 $($Author: ghinkl $ / $Date: 2004/04/16 15:49:47 $)
-->

<Dashboard version="1.0" name="JBoss Server Control">
  <Description>This dashboard has server control operations for JBoss.</Description>
 
  <DashboardMatch type="Global" location="/JBoss">
      <BeanMatch id="JBossServerNode" type="Single">
          <Condition type="BeanObjectNameCondition" filter="^jboss.system:type=Server$"/>
      </BeanMatch>
  </DashboardMatch>

  <LayoutManager type="java.awt.BorderLayout"/>
  <Content>
    
    <!-- *** The header section displays title and a refresh control *** -->
    <Component type="javax.swing.JPanel">
        <Constraint type="BorderConstraints" direction="NORTH"/>
        <LayoutManager type="java.awt.BorderLayout"/>
        <Border type="javax.swing.border.EmptyBorder" top="(Literal)2" left="(Literal)5" bottom="(Literal)2" right="(Literal)5"/>
        <Content>
            <Component type="javax.swing.JPanel">
                <Constraint type="BorderConstraints" direction="CENTER"/>
                <LayoutManager type="java.awt.BorderLayout"/>
                <Content>
                    <Component type="javax.swing.JLabel" id="titleLable">
                        <Constraint type="BorderConstraints" direction="CENTER"/>
                        <Attribute name="text" value="DashboardName"/>
                        <Attribute name="font" value="(Literal)SansSerif bold 20"/>
                        <Attribute name="foreground" value="(Literal)0x666666"/>
                    </Component>
                    <Component type="javax.swing.JTextArea">
                        <Constraint type="BorderConstraints" direction="SOUTH"/>
                        <Attribute name="text" value="DashboardDescription"/>
                        <Attribute name="font" value="(Literal)DialogInput bold 14"/>
                        <Attribute name="opaque" value="(Literal)false"/>
                        <Attribute name="editable" value="(Literal)false"/>
                    </Component>
                </Content>
            </Component>
        </Content>
    </Component>
    
    <Component type="javax.swing.JScrollPane">
        <Constraint type="BorderConstraints" direction="CENTER"/>
        
        <Content>
            <Component type="javax.swing.JPanel">
                <Content>
                    <Component type="org.mc4j.console.dashboard.components.OperationListComponent">
                        <Attribute name="beanNode" value="JBossServerNode"/>
                        <Attribute name="operationName" value="(Literal)runGarbageCollector"/>
                        <Attribute name="operationName" value="(Literal)exit"/>
                        <Attribute name="operationName" value="(Literal)halt"/>
                        <Attribute name="operationName" value="(Literal)shutdown"/>
                    </Component>
                </Content>
            </Component>
        </Content>
        
    </Component>
    
  </Content>
</Dashboard>
