<?xml version="1.0" encoding="UTF-8"?>
<!DOCTYPE Dashboard PUBLIC "-//MC4J//DTD Dashboard 1.0//EN" "http://mc4j.sourceforge.net/Dashboard_1_0.dtd">

<!--
    Created on : October 6, 2002, 10:01 PM
    Author     : ghinkl
-->

<Dashboard version="1.0" name="JBoss Server Dashboard">
  <Description>This dashboard displays basic information relating to the
    overall execution of a WebSphere server.</Description>

    <DashboardMatch type="Global" location="/WebSphere">
        <!--
        Example Object name:
        WebSphere:
            name=server1,
            process=server1,
            platform=common,
            node=gregh,
            j2eeType=J2EEServer,
            version=5.0,
            type=Server,
            mbeanIdentifier=cells/gregh/nodes/gregh/servers/server1/server.xml#Server_1,cell=gregh,
            processType=UnManagedProcess
        -->

        <BeanMatch id="ServerBean" type="Single">
            <Condition type="BeanObjectNameCondition" filter="WebSphere:"/>
            <Condition type="BeanObjectNameCondition" filter="type=Server"/>
        </BeanMatch>

        <!--
        Example Object name:
        WebSphere:
            name=JVM,
            process=server1,
            platform=common,
            node=gregh,
            j2eeType=JVM,
            J2EEServer=server1,
            version=6.0,
            type=JVM,
            mbeanIdentifier=JVM,
            cell=gregh
        -->
        <BeanMatch id="JVMBean" type="Single">
            <Condition type="BeanObjectNameCondition" filter="WebSphere:"/>
            <Condition type="BeanObjectNameCondition" filter="type=JVM"/>
        </BeanMatch>

    </DashboardMatch>


  <LayoutManager type="java.awt.BorderLayout"/>
  <Content>
      <Component type="org.mc4j.console.dashboard.components.html.HtmlDashboardComponent">
          <Attribute name="htmlDocumentName" value="(Literal)WebSphere/WebSphere_ServerDashboard.html"/>

        <Content>




            <!--
            TODO GH: Doesn't work since IBM returns strings
            <Component id="memoryMeter" type="org.mc4j.console.dashboard.components.NumericAttributeGaugeMeter">
                <Constraint type="BorderConstraints" direction="CENTER"/>
                <Attribute name="beanNode" value="JVMBean"/>
                <Attribute name="maxAttributeName" value="(Literal)heapSize"/>
                <Attribute name="currentAttributeName" value="(Literal)freeMemory"/>
                <Attribute name="label" value="(Literal)Free Memory"/>
                <Attribute name="updateInterval" value="(Literal)1000"/>
                <Attribute name="warningPoint" value="(Literal)0.15"/>
                <Attribute name="criticalPoint" value="(Literal)0.05"/>
                <Attribute name="title" value="(Literal)Available Memory"/>
                <Attribute name="units" value="(Literal)MB"/>
                <Attribute name="opaque" value="(Literal)false"/>
                <Attribute name="unitConverter" value="(Literal)org.mc4j.console.util.unit.ByteToMegaByteConverter"/>
            </Component>
            -->

            <!--
            <Component id="memoryMeter" type="org.mc4j.console.dashboard.components.NumericAttributeMeter">
                <Attribute name="beanNode" value="JBossServerInfoBean"/>
                <Attribute name="preferredSize" value="(Literal)150,150"/>
                <Attribute name="maxAttributeName" value="(Literal)MaxMemory"/>
                <Attribute name="currentAttributeName" value="(Literal)FreeMemory"/>
                <Attribute name="minimumSize" value="(Literal)50,50"/>
                <Attribute name="label" value="(Literal)Free Memory"/>
                <Attribute name="updateInterval" value="(Literal)1000"/>

            </Component>


            <Component type="org.mc4j.console.dashboard.components.NumericAttributeGraph">
                <Attribute name="beanNode" value="JBossServerInfoBean"/>
                <Constraint type="java.awt.GridBagConstraints" anchor="NORTH" gridx="1" gridy="2" widthx="2" weightx="0.5" weighty="0.5" fill="BOTH" insets="3,3,3,3"/>
                <Attribute name="preferredSize" value="(Literal)100,100"/>
                <Attribute name="attributeName" value="(Literal)FreeMemory"/>
            </Component>
            -->
        </Content>

      </Component>

  </Content>
</Dashboard>
