<?xml version="1.0" encoding="UTF-8"?>
<!DOCTYPE Dashboard PUBLIC "-//MC4J//DTD Dashboard 1.0//EN" "http://mc4j.sourceforge.net/Dashboard_1_0.dtd">

<!--
    Created on : October 6, 2002, 10:01 PM
    Author     : ghinkl
-->

<Dashboard version="1.0" name="Geronimo Server Info">
  <Description>This dashboard displays basic information relating to the
    overall execution of a Geronimo server.</Description>

    <DashboardMatch type="Global" location="/Geronimo">


        <BeanMatch id="GeronimoJ2EEServer" type="Single">
            <Condition type="BeanObjectNameCondition" filter="j2eeType=J2EEServer"/>
        </BeanMatch>



        <BeanMatch id="JVM" type="Single">
            <Condition type="BeanObjectNameCondition" filter="j2eeType=JVM"/>
        </BeanMatch>


        <BeanMatch id="GeronimoSystemInfo" type="Single">
            <Condition type="BeanObjectNameCondition" filter="geronimo.system:role=ServerInfo"/>
        </BeanMatch>


    </DashboardMatch>


  <LayoutManager type="java.awt.BorderLayout"/>
  <Content>
      <Component type="org.mc4j.console.dashboard.components.html.HtmlDashboardComponent">
          <Attribute name="htmlDocumentName" value="(Literal)Geronimo/Geronimo_ServerInfo.html"/>

        <Content>



            <Component id="memoryMeter" type="org.mc4j.console.dashboard.components.NumericAttributeGaugeMeter">
                <Constraint type="BorderConstraints" direction="CENTER"/>
                <Attribute name="beanNode" value="JVM"/>
                <Attribute name="maxAttributeName" value="(Literal)maxMemory"/>
                <Attribute name="currentAttributeName" value="(Literal)freeMemory"/>
                <Attribute name="label" value="(Literal)Free Memory"/>
                <Attribute name="updateInterval" value="(Literal)1000"/>
                <Attribute name="warningPoint" value="(Literal)0.15"/>
                <Attribute name="criticalPoint" value="(Literal)0.05"/>
                <Attribute name="title" value="(Literal)Available Memory"/>
                <Attribute name="units" value="(Literal)MB"/>
                <Attribute name="opaque" value="(Literal)false"/>
                <Attribute name="unitConverter" value="(Literal)org.mc4j.console.util.unit.ByteToMegaByteConverter"/>
            </Component>

            <!--

            <Component type="org.mc4j.console.dashboard.components.NumericAttributeGraph">
                <Attribute name="beanNode" value="JBossServerInfoBean"/>
                <Constraint type="java.awt.GridBagConstraints" anchor="NORTH" gridx="1" gridy="2" widthx="2" weightx="0.5" weighty="0.5" fill="BOTH" insets="3,3,3,3"/>
                <Attribute name="preferredSize" value="(Literal)100,100"/>
                <Attribute name="attributeName" value="(Literal)FreeMemory"/>
            </Component>
            -->
        </Content>

      </Component>

  </Content>
</Dashboard>
